{
  "id": "example.usgs-3dep-dem",
  "title": "Example USGS 3DEP DEM data contract",
  "description": "Minimal valid example of a TSM data contract for an authoritative elevation dataset.",
  "owner": {
    "organization": "Example steward"
  },
  "authoritative_source": {
    "system": "USGS 3DEP"
  },
  "jurisdiction": "Tri-State",
  "domain": "hydrology",
  "classification": "public",
  "legal_basis": "Public domain federal dataset",
  "collection_method": "Airborne lidar acquisition",
  "spatial_extent": {
    "description": "Example project AOI"
  },
  "temporal_extent": {
    "start": "2024-01-01T00:00:00Z"
  },
  "update_frequency": "static",
  "schema_version": "1.0.0",
  "lineage": [
    {
      "source_id": "usgs-3dep"
    }
  ],
  "quality": {
    "score": 0.9
  },
  "license": {
    "name": "Public domain"
  },
  "retention": {
    "policy": "retain-indefinitely"
  },
  "permitted_uses": [
    "modeling",
    "research"
  ],
  "prohibited_uses": [
    "autonomous-decision-without-human-oversight"
  ],
  "privacy_controls": [],
  "provenance": {
    "evidence_id": "ev-001",
    "content_hash": "0123456789abcdef0123456789abcdef0123456789abcdef0123456789abcdef",
    "created_at": "2026-09-25T12:00:00Z"
  },
  "validation_status": "draft"
}
